{"schemaVersion":"1.0","experimentId":"core-prompt-ablation","kind":"prompt_ablation","candidates":[{"id":"technical"},{"id":"mission"},{"id":"artifact_contract"},{"id":"full_persona"}],"cases":[{"id":"implementation"}],"metrics":[{"name":"task_success","direction":"maximize","unit":"ratio"},{"name":"tokens","direction":"minimize","unit":"tokens"}],"hardConstraints":[],"budget":{"trials":8,"tokens":12000,"wallClockSeconds":120,"maxConcurrency":2,"retriesPerTrial":1},"stoppingConditions":[{"type":"budget"}],"validation":{"kind":"independent_evaluator"},"promotionState":"shadow"}
