{"schemaVersion":"1.0","experimentId":"core-evaluator","kind":"evaluator","candidates":[{"id":"self"},{"id":"independent"},{"id":"deterministic_plus_evaluator"}],"cases":[{"id":"known_pass"},{"id":"known_fail"}],"metrics":[{"name":"agreement","direction":"maximize","unit":"ratio"}],"hardConstraints":[],"budget":{"trials":6,"tokens":6000,"wallClockSeconds":60,"maxConcurrency":2,"retriesPerTrial":1},"stoppingConditions":[{"type":"budget"}],"validation":{"kind":"gold_labels"},"promotionState":"shadow"}
