{"schemaVersion":"1.0","experimentId":"core-handoff","kind":"handoff","candidates":[{"id":"full_log"},{"id":"free_summary"},{"id":"structured_packet"}],"cases":[{"id":"resume_task"}],"metrics":[{"name":"recovery_accuracy","direction":"maximize","unit":"ratio"},{"name":"tokens","direction":"minimize","unit":"tokens"}],"hardConstraints":[],"budget":{"trials":6,"tokens":6000,"wallClockSeconds":60,"maxConcurrency":2,"retriesPerTrial":1},"stoppingConditions":[{"type":"budget"}],"validation":{"kind":"resume_check"},"promotionState":"shadow"}
